{
  "$schema": "https://json-schema.org/draft/2020-12/schema",
  "$id": "https://example.invalid/schemas/takhrij_cases.schema.json",
  "title": "M4 takhrīj cases: furūʿ annotated against a formal reading (candidates)",
  "type": "object",
  "required": [
    "suite",
    "status",
    "provenance",
    "cases"
  ],
  "additionalProperties": false,
  "properties": {
    "suite": {
      "type": "string"
    },
    "status": {
      "const": "candidate"
    },
    "provenance": {
      "type": "string",
      "minLength": 1
    },
    "cases": {
      "type": "array",
      "items": {
        "type": "object",
        "required": [
          "far",
          "encoder",
          "class",
          "note"
        ],
        "additionalProperties": false,
        "properties": {
          "far": {
            "type": "string",
            "pattern": "\\.(?:f[0-9]{3}|f000_[2-9]|qa[0-9]{5}|m[0-9]{5}|b[0-9]{5})$"
          },
          "encoder": {
            "type": "string"
          },
          "class": {
            "enum": [
              "derivable",
              "genuine_ikhtilaf",
              "encoding_error",
              "missing_fact",
              "missing_rule",
              "segmentation_error"
            ]
          },
          "facts": {
            "type": [
              "object",
              "null"
            ]
          },
          "expected": {},
          "positions": {
            "type": "array",
            "items": {
              "type": "object",
              "required": [
                "who",
                "ruling"
              ],
              "properties": {
                "outside": {
                  "type": "string",
                  "pattern": "\\S",
                  "description": "Explicit explanation for a nonempty textual ruling outside the encoder output domain; never permits a mistyped scalar or changes ruling identity."
                },
                "detail": {
                  "type": "string",
                  "minLength": 1,
                  "description": "What the source adds to the position beyond its ruling, which stays an encoder code where the encoder has one."
                }
              }
            }
          },
          "matches_madhhab": {
            "type": "boolean",
            "description": "Whether the source labels the kernel's position the madhhab's. Descriptive of the text; never a scoring target (a ruling stands by its proof)."
          },
          "routing_label": {
            "type": "boolean",
            "description": "False for proposal triage or scoped component guards that do not establish the correct whole-unit encoder; excluded from routing training and recall labels. Defaults to true for legacy cases."
          },
          "note": {
            "type": "string",
            "minLength": 1
          },
          "quote": {
            "type": "string",
            "minLength": 1,
            "description": "The source's own words stating the case's ruling, verbatim (fatwa tranches)."
          },
          "iq": {
            "type": "string",
            "pattern": "^IQ-[0-9]{2}$"
          },
          "needs": {
            "type": "array",
            "items": {
              "type": "string",
              "pattern": "^(fact|rule):[a-z_]+$"
            },
            "minItems": 1
          },
          "revisit": {
            "type": "object",
            "required": [
              "from_class",
              "closed_by"
            ],
            "additionalProperties": false,
            "properties": {
              "from_class": {
                "type": "string"
              },
              "from_encoder": {
                "type": "string"
              },
              "closed_by": {
                "type": "array",
                "items": {
                  "type": "string"
                }
              },
              "note": {
                "type": "string"
              }
            }
          },
          "home": {
            "type": "string",
            "description": "The encoder whose qāʿida this farʿ belongs to, when the case is decided under another encoder (a fresh annotation, not a revisit)."
          },
          "side_check": {
            "type": "object",
            "required": [
              "from_matches",
              "refs",
              "contradictions"
            ],
            "additionalProperties": false,
            "description": "Lane D: the annotated madhhab side failed verification against al-Inṣāf and the muʿtamad. Keeps the annotated value; the evidence is in the ledger.",
            "properties": {
              "from_matches": {
                "const": true
              },
              "refs": {
                "type": "array",
                "minItems": 1,
                "items": {
                  "type": "string",
                  "pattern": "^src:"
                },
                "uniqueItems": true
              },
              "note": {
                "type": "string"
              },
              "contradictions": {
                "type": "array",
                "minItems": 1,
                "items": {
                  "type": "object",
                  "additionalProperties": false,
                  "required": [
                    "evidence_index",
                    "case_facts",
                    "rationale"
                  ],
                  "properties": {
                    "evidence_index": {
                      "type": "integer",
                      "minimum": 0
                    },
                    "case_facts": {
                      "type": "object"
                    },
                    "rationale": {
                      "type": "string",
                      "minLength": 1
                    }
                  }
                }
              }
            }
          },
          "basis": {
            "type": "string",
            "minLength": 1,
            "maxLength": 400,
            "description": "co-annotations only: the farʿ's own words that settle this encoder's facts"
          }
        }
      }
    }
  }
}
