{
 "suite": "m8_rajab_tranche_6",
 "status": "candidate",
 "provenance": "M8 sixth tranche: every far record of Ibn Rajab's qawāʿid 3, 9, 14 and 15, annotated against readings formalised from each qāʿida's own statement (Usul.Refinements). Annotated by reading the full paragraph in the pinned witness; every claim of agreement is guarded by Lean (UsulTest/Takhrij.lean); classes and facts await human review (Review.tla).",
 "cases": [
  {
   "far": "ibn_rajab.taqrir_qawaid.openiti_rajab_shamela21730.q003.f000",
   "encoder": "excess_obligatory",
   "class": "genuine_ikhtilaf",
   "facts": {
    "separable": false,
    "originally_due": false
   },
   "expected": false,
   "positions": [
    {
     "who": "the excess is not obligatory: not caught",
     "ruling": false
    },
    {
     "who": "the whole is obligatory, or due in following (Ibn ʿAqīl's iḥtimāl): caught",
     "ruling": true
    }
   ],
   "matches_madhhab": false,
   "note": "Joining the imam in rukūʿ after the minimum has passed: is he counted as catching it in the farḍ? al-Qāḍī and Ibn ʿAqīl build it on the two wujūh; Ibn ʿAqīl's iḥtimāl: the excess counts as due in following alone."
  },
  {
   "far": "ibn_rajab.taqrir_qawaid.openiti_rajab_shamela21730.q003.f001",
   "encoder": "excess_obligatory",
   "class": "genuine_ikhtilaf",
   "facts": {
    "separable": false,
    "originally_due": false
   },
   "expected": false,
   "positions": [
    {
     "who": "a seventh is the due",
     "ruling": false
    },
    {
     "who": "all is due",
     "ruling": true
    }
   ],
   "matches_madhhab": false,
   "note": "A camel slaughtered where a sheep is due: all obligatory or a seventh? «على وجهين»; likewise a camel for five camels (al-Qāḍī Abū Yaʿlā al-Ṣaghīr, two wujūh). No madhhab marked."
  },
  {
   "far": "ibn_rajab.taqrir_qawaid.openiti_rajab_shamela21730.q003.f002",
   "encoder": "excess_obligatory",
   "class": "genuine_ikhtilaf",
   "facts": {
    "separable": false,
    "originally_due": false
   },
   "expected": false,
   "positions": [
    {
     "who": "the measure due is farḍ, the rest nafl",
     "ruling": false
    },
    {
     "who": "the whole is farḍ",
     "ruling": true
    }
   ],
   "matches_madhhab": false,
   "note": "Wiping the whole head at once where the farḍ is the forelock's measure: all farḍ, or the forelock's measure? The qāʿida's two wujūh; no ruling stated."
  },
  {
   "far": "ibn_rajab.taqrir_qawaid.openiti_rajab_shamela21730.q003.f003",
   "encoder": "excess_obligatory",
   "class": "genuine_ikhtilaf",
   "facts": {
    "separable": false,
    "originally_due": false
   },
   "expected": false,
   "positions": [
    {
     "who": "al-Qāḍī: part is taṭawwuʿ (al-ṣawāb)",
     "ruling": false
    },
    {
     "who": "Abū al-Khaṭṭāb: all farḍ",
     "ruling": true
    }
   ],
   "matches_madhhab": false,
   "note": "An older animal than due in zakāt: Abū al-Khaṭṭāb all farḍ; al-Qāḍī part taṭawwuʿ «وهو الصواب ; لأن الشارع أعطاه جبرانا عن الزيادة». The traveller praying four, the whole being originally due, is the other branch («والمذهب الأول»)."
  },
  {
   "far": "ibn_rajab.taqrir_qawaid.openiti_rajab_shamela21730.q009.f000",
   "encoder": "prohibited_worship",
   "class": "derivable",
   "facts": {
    "site": "essence"
   },
   "expected": false,
   "note": "Fasting the day of ʿĪd: «فلا يصح بحال على المذهب»; and prayer in the forbidden times."
  },
  {
   "far": "ibn_rajab.taqrir_qawaid.openiti_rajab_shamela21730.q009.f001",
   "encoder": "prohibited_worship",
   "class": "derivable",
   "facts": {
    "site": "essence"
   },
   "expected": false,
   "note": "Prayer in the places of prohibition: not ṣaḥīḥ on the view that the prohibition is taḥrīm, «هذه طريقة المحققين»; the tashrīq days not valid as a voluntary fast. The second type (a specific condition: prayer with najāsa, without a covering) is likewise not ṣaḥīḥ."
  },
  {
   "far": "ibn_rajab.taqrir_qawaid.openiti_rajab_shamela21730.q009.f002",
   "encoder": "prohibited_worship",
   "class": "genuine_ikhtilaf",
   "facts": {
    "site": "generalCondition"
   },
   "expected": false,
   "positions": [
    {
     "who": "not ṣaḥīḥ (the ashhar of the two riwāyas)",
     "ruling": false
    },
    {
     "who": "valid",
     "ruling": true
    }
   ],
   "matches_madhhab": true,
   "note": "Prayer on usurped ground: the third type, «وفيها الخلاف», with two maʾkhadh for buṭlān (its being bāṭil); the reading takes the qāʿida's «أشهرهما عدمها»."
  },
  {
   "far": "ibn_rajab.taqrir_qawaid.openiti_rajab_shamela21730.q009.f003",
   "encoder": "prohibited_worship",
   "class": "genuine_ikhtilaf",
   "facts": {
    "site": "external"
   },
   "expected": true,
   "positions": [
    {
     "who": "the majority: valid",
     "ruling": true
    },
    {
     "who": "Abū Bakr: not ṣaḥīḥ",
     "ruling": false
    }
   ],
   "matches_madhhab": true,
   "note": "Prayer in a usurped or silk turban, or with a gold ring: the fourth type, two wujūh; Abū Bakr: not ṣaḥīḥ; «وخالفه الأكثرون». Ḥajj with usurped wealth: two riwāyas; Ibn ʿAqīl counts it of the fourth type."
  },
  {
   "far": "ibn_rajab.taqrir_qawaid.openiti_rajab_shamela21730.q014.f000",
   "encoder": "one_of_two",
   "class": "genuine_ikhtilaf",
   "facts": {
    "together": false
   },
   "expected": false,
   "positions": [
    {
     "who": "riwāya: neither, each on his certainty",
     "ruling": false
    },
    {
     "who": "riwāya: both, the aṣl having ended in one",
     "ruling": true
    }
   ],
   "matches_madhhab": false,
   "note": "Two find al-manī in a garment they sleep in, or hear a ṣawt exit («سمعا صوتا خارجا»: wind breaking, a ḥadath), not knowing from which of them: two riwāyas; neither owes ghusl or wuḍūʾ («لا يلزم واحدا منهما غسل ولا وضوء», «متيقن للطهارة شاك في الحدث»), or both owe them. Together, one may not lead the other (14.f002)."
  },
  {
   "far": "ibn_rajab.taqrir_qawaid.openiti_rajab_shamela21730.q014.f001",
   "encoder": "one_of_two",
   "class": "genuine_ikhtilaf",
   "facts": {
    "together": false
   },
   "expected": false,
   "positions": [
    {
     "who": "each on the certainty of his marriage",
     "ruling": false
    },
    {
     "who": "a lot between the two",
     "ruling": true
    }
   ],
   "matches_madhhab": false,
   "note": "One swears divorce if the bird is a crow, the other if it is not, and it flew off: each builds on the certainty of his marriage (al-Qāḍī in al-Mujarrad, Abū al-Khaṭṭāb), or a lot (al-Shīrāzī, Ibn ʿAqīl; al-Qāḍī in al-Jāmiʿ: «هو قياس المذهب»)."
  },
  {
   "far": "ibn_rajab.taqrir_qawaid.openiti_rajab_shamela21730.q014.f002",
   "encoder": "one_of_two",
   "class": "genuine_ikhtilaf",
   "facts": {
    "together": true
   },
   "expected": true,
   "positions": [
    {
     "who": "a lot, the two now together (aṣaḥḥ al-wajhayn)",
     "ruling": true
    },
    {
     "who": "each on his certainty",
     "ruling": false
    }
   ],
   "matches_madhhab": true,
   "note": "The same with two slave-women freed: «قياس المنصوص» that each abstains until certain; if one buys the other's, the freed one is fixed by lot «على أصح الوجهين لاجتماعهما في ملكه», «فينظر إليهما مجتمعين في حكم يتعلق باجتماعهما»."
  },
  {
   "far": "ibn_rajab.taqrir_qawaid.openiti_rajab_shamela21730.q015.f001",
   "encoder": "separate_presumptions",
   "class": "derivable",
   "facts": {
    "alters_another_asl": true
   },
   "expected": false,
   "note": "Wetness found on waking, no ghusl (taken as madhy): the garment need not be washed; each keeps its aṣl, «الأصل طهارته فلا ينجس بالشك» (Ibn ʿAqīl from al-Sharīf Abū Jaʿfar)."
  },
  {
   "far": "ibn_rajab.taqrir_qawaid.openiti_rajab_shamela21730.q015.f002",
   "encoder": "separate_presumptions",
   "class": "derivable",
   "facts": {
    "alters_another_asl": true
   },
   "expected": false,
   "note": "Doubt whether he wiped the khuff before or after the prayer: the period starts before it and the prayer is repeated, «لأن الأصل وجوب غسل الرجلين والأصل بقاء الصلاة في الذمة»."
  },
  {
   "far": "ibn_rajab.taqrir_qawaid.openiti_rajab_shamela21730.q015.f003",
   "encoder": "separate_presumptions",
   "class": "derivable",
   "facts": {
    "alters_another_asl": true
   },
   "expected": false,
   "note": "Game shot and found dead in a little water: not lawful, and the water is not made najis, «بل يستصحب في الماء أصل الطهارة فلا ينجسه بالشك» (Ibn ʿAqīl, al-Fuṣūl)."
  },
  {
   "far": "ibn_rajab.taqrir_qawaid.openiti_rajab_shamela21730.q015.f004",
   "encoder": "separate_presumptions",
   "class": "genuine_ikhtilaf",
   "facts": {
    "alters_another_asl": true
   },
   "expected": false,
   "positions": [
    {
     "who": "the ḥadd too: the incompatibility is not carried",
     "ruling": false
    },
    {
     "who": "no ḥadd: the two are incompatible",
     "ruling": true
    }
   ],
   "matches_madhhab": false,
   "note": "«اعتدي» in anger with signs of accusing her: divorce falls; the ḥadd too? Ibn ʿAqīl's two iḥtimāls: the ḥadd, «لأنهما حقان عليه» (asserted in ʿUmad al-Adilla), or none, «لتنافيهما». The qāʿida's side does not carry the incompatibility."
  }
 ]
}
